{
  "schema_version": "intake_metadata_v0.1",
  "book_id": "ibn_aqil",
  "title": "شرح ابن عقيل على ألفية ابن مالك",
  "title_formal": "شرح ابن عقيل على ألفية ابن مالك",
  "shamela_author_short": "ابن عقيل",
  "author": "ابن عقيل، عبد الله بن عبد الرحمن العقيلي الهمداني المصري (المتوفى: 769 هـ)",
  "muhaqiq": "محمد محيي الدين عبد الحميد [ت 1392 هـ]",
  "publisher": "دار التراث - القاهرة، دار مصر للطباعة، سعيد جودة السحار وشركاه",
  "shamela_page_count": null,
  "shamela_edition": "العشرون 1400 هـ - 1980 م",
  "shamela_volume_count": 4,
  "publication_year": null,
  "html_qism_field": "النحو والصرف",
  "shamela_pub_date": "8 ذو الحجة 1431",
  "primary_science": "nahw",
  "book_category": "single_science",
  "science_parts": null,
  "volume_count": 4,
  "total_actual_pages": 1328,
  "source_files": [
    {
      "relpath": "books/ibn_aqil/source/001.htm",
      "sha256": "13f42287d1eb179d769e311193de6b000b12873160aa88e4dbb03344b6c7d6d0",
      "size_bytes": 1151587,
      "role": "volume",
      "volume_number": 1,
      "actual_page_count": 390,
      "file_note": null
    },
    {
      "relpath": "books/ibn_aqil/source/002.htm",
      "sha256": "a567e3784f60703c4c2154ff59c1a6bd05213090ca6e3cfecfc0431a7ee344b0",
      "size_bytes": 793366,
      "role": "volume",
      "volume_number": 2,
      "actual_page_count": 291,
      "file_note": null
    },
    {
      "relpath": "books/ibn_aqil/source/003.htm",
      "sha256": "da847f34106b31e13c34ce9bbe3fa3f9cf9c7574380170fd808d4357f13ab030",
      "size_bytes": 323392,
      "role": "volume",
      "volume_number": 3,
      "actual_page_count": 328,
      "file_note": null
    },
    {
      "relpath": "books/ibn_aqil/source/004.htm",
      "sha256": "e9216bd2cfc5639f2ce37beab4ff9b0bf40c1c967996b196068bcc6c9ee3372c",
      "size_bytes": 375840,
      "role": "volume",
      "volume_number": 4,
      "actual_page_count": 319,
      "file_note": null
    }
  ],
  "unrecognized_metadata_lines": [
    "[ترقيم الكتاب موافق للمطبوع، وأول مجلدين، بحاشية: منحة الجليل، بتحقيق شرح ابن عقيل]"
  ],
  "edition_notes": "4-volume commentary on ألفية ابن مالك. Vols 1-2 have footnotes, vols 3-4 do not.",
  "language": "ar",
  "intake_utc": "2026-02-25T16:07:04Z",
  "taxonomy_at_intake": {
    "balagha": "balagha_v0_4",
    "sarf": "sarf_v0_1",
    "nahw": "nahw_v0_1",
    "imlaa": "imlaa_v0_1"
  }
}
