{
  "schema_version": "intake_metadata_v0.1",
  "book_id": "shadha",
  "title": "شذا العرف في فن الصرف",
  "title_formal": "شذا العرف في فن الصرف",
  "shamela_author_short": "أحمد بن محمد الحملاوي",
  "author": "أحمد بن محمد الحملاوي (ت 1351هـ)",
  "muhaqiq": "نصر الله عبد الرحمن نصر الله",
  "publisher": "مكتبة الرشد الرياض",
  "shamela_page_count": 170,
  "shamela_edition": null,
  "shamela_volume_count": null,
  "publication_year": null,
  "html_qism_field": "النحو والصرف",
  "shamela_pub_date": "8 ذو الحجة 1431",
  "primary_science": "sarf",
  "book_category": "single_science",
  "science_parts": null,
  "volume_count": 1,
  "total_actual_pages": 187,
  "source_files": [
    {
      "relpath": "books/shadha/source/shadha_al_arf.htm",
      "sha256": "8c3fcc8e69b7b573b45be8eb3429748d6ddd43b1e6795382812dbefc5aaf1579",
      "size_bytes": 451659,
      "role": "primary_export",
      "volume_number": null,
      "actual_page_count": 187,
      "file_note": null
    }
  ],
  "unrecognized_metadata_lines": [],
  "edition_notes": "Shamela desktop HTML export. Modern textbook (صرف).",
  "language": "ar",
  "intake_utc": "2026-02-25T16:06:48Z",
  "taxonomy_at_intake": {
    "balagha": "balagha_v0_4",
    "sarf": "sarf_v0_1",
    "nahw": "nahw_v0_1",
    "imlaa": "imlaa_v0_1"
  }
}
